{
  "schemaVersion": 1,
  "version": "0.1.0",
  "platforms": [
    "darwin-arm64"
  ],
  "runtimes": {
    "node": {
      "version": "24.21.0",
      "license": "MIT and bundled third-party licences",
      "notices": "LICENSE",
      "provenance": "https://nodejs.org/dist/v24.21.0/SHASUMS256.txt.asc; verified signing key 5BE8A3F6C8A5C01D106C0AD820B1A390B168D356",
      "entry": {
        "darwin-arm64": "bin/node",
        "darwin-x64": "bin/node",
        "linux-x64": "bin/node",
        "win32-x64": "node.exe"
      },
      "archives": {
        "darwin-arm64": {
          "status": "published",
          "url": "https://nodejs.org/dist/v24.21.0/node-v24.21.0-darwin-arm64.tar.gz",
          "sha256": "bed7eea5325e1108f32ce5228ddd6a5f0f08a499ee42aa7442aea583702f6057",
          "format": "tar.gz",
          "stripComponents": 1
        },
        "darwin-x64": {
          "status": "published",
          "url": "https://nodejs.org/dist/v24.21.0/node-v24.21.0-darwin-x64.tar.gz",
          "sha256": "1462cb3b3046b815cf8ea436d3da450ec1a9f11dac7e5a46b0ada5305d7e8097",
          "format": "tar.gz",
          "stripComponents": 1
        },
        "linux-x64": {
          "status": "published",
          "url": "https://nodejs.org/dist/v24.21.0/node-v24.21.0-linux-x64.tar.gz",
          "sha256": "6e1db87ef58b8819e5d5402eff1536491b18edd8eb7bee5ef7897876e88dc5ff",
          "format": "tar.gz",
          "stripComponents": 1
        },
        "win32-x64": {
          "status": "published",
          "url": "https://nodejs.org/dist/v24.21.0/node-v24.21.0-win-x64.zip",
          "sha256": "158f7685b44de51f6c0df1d153526cbcd3e1bc739a8dfc607721cef75de9e541",
          "format": "zip",
          "stripComponents": 1
        }
      }
    },
    "typst": {
      "version": "0.15.1",
      "license": "Apache-2.0",
      "notices": "LICENSE",
      "provenance": "https://api.github.com/repos/typst/typst/releases/tags/v0.15.1; official asset SHA-256 digests",
      "entry": {
        "darwin-arm64": "typst",
        "darwin-x64": "typst",
        "linux-x64": "typst",
        "win32-x64": "typst.exe"
      },
      "archives": {
        "darwin-arm64": {
          "status": "published",
          "url": "https://github.com/typst/typst/releases/download/v0.15.1/typst-aarch64-apple-darwin.tar.xz",
          "sha256": "48f62ed034aa3a7978309579ac6ca00045e2ef0da73114e8af27cfd8e74dc05a",
          "format": "tar.xz",
          "stripComponents": 1
        },
        "darwin-x64": {
          "status": "published",
          "url": "https://github.com/typst/typst/releases/download/v0.15.1/typst-x86_64-apple-darwin.tar.xz",
          "sha256": "7f9fdd9584866245de9a79e0add8f9236fae6f40a8a45e2c4771ccc14db4e0fa",
          "format": "tar.xz",
          "stripComponents": 1
        },
        "linux-x64": {
          "status": "published",
          "url": "https://github.com/typst/typst/releases/download/v0.15.1/typst-x86_64-unknown-linux-musl.tar.xz",
          "sha256": "a6d077d0a95eed5a2eba715b2dae06be954f624ccbf85758a03f389ded33118c",
          "format": "tar.xz",
          "stripComponents": 1
        },
        "win32-x64": {
          "status": "published",
          "url": "https://github.com/typst/typst/releases/download/v0.15.1/typst-x86_64-pc-windows-msvc.zip",
          "sha256": "19ce3551153c2fe7ee9fa2f95208310c8f4d3209fedb699e0333faf8913f6736",
          "format": "zip",
          "stripComponents": 1
        }
      }
    }
  },
  "tools": [
    {
      "id": "studio",
      "version": "0.3.0-main.0e6581e9",
      "entry": "praxity.mjs",
      "runner": "node",
      "license": "PolyForm Perimeter 1.0.1",
      "notices": "legal/LICENSING.md",
      "skillPath": "prax-format/skill",
      "archives": {
        "darwin-arm64": {
          "status": "published",
          "url": "https://github.com/Praxity/praxity-toolkit/releases/download/v0.1.0-rc.1/praxity-studio-cli-0.3.0-main.0e6581e9-darwin-arm64.tar.gz",
          "sha256": "dd1924bcbce6d1a6f52260e32222d5afdfe3837cb48cf25f06d7c409cd6da0e4",
          "format": "tar.gz",
          "stripComponents": 1
        },
        "darwin-x64": {
          "status": "unpublished",
          "reason": "Studio CLI candidates are built for macOS on the self-hosted Mac; only darwin-arm64 is in the trial."
        },
        "linux-x64": {
          "status": "unpublished",
          "reason": "Studio CLI candidates are built for macOS on the self-hosted Mac; only darwin-arm64 is in the trial."
        },
        "win32-x64": {
          "status": "unpublished",
          "reason": "Studio CLI candidates are built for macOS on the self-hosted Mac; only darwin-arm64 is in the trial."
        }
      }
    },
    {
      "id": "check",
      "version": "0.6.0",
      "entry": "lib/cli.js",
      "runner": "node",
      "setup": [
        "setup"
      ],
      "doctor": [
        "doctor",
        "--json"
      ],
      "license": "PolyForm Perimeter 1.0.1",
      "notices": "THIRD-PARTY-NOTICES.md",
      "skillPath": "skill",
      "archives": {
        "darwin-arm64": {
          "status": "published",
          "url": "https://github.com/Praxity/praxity-toolkit/releases/download/v0.1.0-rc.1/praxity-check-0.6.0-portable.tar.gz",
          "sha256": "9b878ef21facbd99dc41b465a8be6da8193ae1fe7725b23a94f25db22200d502",
          "format": "tar.gz",
          "stripComponents": 1
        },
        "darwin-x64": {
          "status": "unpublished",
          "reason": "Portable archive verified only on darwin-arm64 so far; the same file is expected to serve this platform once tested."
        },
        "linux-x64": {
          "status": "unpublished",
          "reason": "Portable archive verified only on darwin-arm64 so far; the same file is expected to serve this platform once tested."
        },
        "win32-x64": {
          "status": "unpublished",
          "reason": "Portable archive verified only on darwin-arm64 so far; the same file is expected to serve this platform once tested."
        }
      }
    },
    {
      "id": "trace",
      "version": "0.1.1",
      "entry": "src/cli.ts",
      "runner": "node",
      "license": "PolyForm Perimeter 1.0.1",
      "notices": "NOTICE.md",
      "skillPath": "skill",
      "archives": {
        "darwin-arm64": {
          "status": "published",
          "url": "https://github.com/Praxity/praxity-toolkit/releases/download/v0.1.0-rc.1/praxity-trace-0.1.1-darwin-arm64.tar.gz",
          "sha256": "52bc5aa82d29892e5570fdb88ec65bd29c728b29b890c9b7aba49bf3f48c5dbb",
          "format": "tar.gz",
          "stripComponents": 1
        },
        "darwin-x64": {
          "status": "unpublished",
          "reason": "Releases have no archives. Archive the pnpm package output with skill and legal payload."
        },
        "linux-x64": {
          "status": "unpublished",
          "reason": "Releases have no archives. Archive the pnpm package output with skill and legal payload."
        },
        "win32-x64": {
          "status": "unpublished",
          "reason": "Releases have no archives. Archive the pnpm package output with skill and legal payload."
        }
      }
    },
    {
      "id": "print",
      "version": "0.1.0",
      "entry": "src/cli.ts",
      "runner": "node",
      "license": "PolyForm Perimeter 1.0.1",
      "notices": "THIRD-PARTY-NOTICES.md",
      "skillPath": "skill",
      "archives": {
        "darwin-arm64": {
          "status": "published",
          "url": "https://github.com/Praxity/praxity-toolkit/releases/download/v0.1.0-rc.1/praxity-print-0.1.0-darwin-arm64.tar.gz",
          "sha256": "221b3bcee019a80500a2fa7560a2aeb0fbf24dc99757254568f02b5ce34f685e",
          "format": "tar.gz",
          "stripComponents": 1
        },
        "darwin-x64": {
          "status": "unpublished",
          "reason": "No release. Publish a portable pnpm package archive with fonts, skill and legal payload."
        },
        "linux-x64": {
          "status": "unpublished",
          "reason": "No release. Publish a portable pnpm package archive with fonts, skill and legal payload."
        },
        "win32-x64": {
          "status": "unpublished",
          "reason": "No release. Publish a portable pnpm package archive with fonts, skill and legal payload."
        }
      }
    },
    {
      "id": "import",
      "version": "0.1.0",
      "entry": "src/cli.ts",
      "runner": "node",
      "license": "PolyForm Perimeter 1.0.1",
      "notices": "THIRD-PARTY-NOTICES.md",
      "skillPath": "skill",
      "archives": {
        "darwin-arm64": {
          "status": "unpublished",
          "reason": "No portable packaging yet. Add packaging, skill and legal payload, then publish archives."
        },
        "darwin-x64": {
          "status": "unpublished",
          "reason": "No portable packaging yet. Add packaging, skill and legal payload, then publish archives."
        },
        "linux-x64": {
          "status": "unpublished",
          "reason": "No portable packaging yet. Add packaging, skill and legal payload, then publish archives."
        },
        "win32-x64": {
          "status": "unpublished",
          "reason": "No portable packaging yet. Add packaging, skill and legal payload, then publish archives."
        }
      }
    }
  ]
}
